{
  "access_class": "PUBLIC",
  "availability": {},
  "capabilities": [
    "CONFORMANCE_ECHO"
  ],
  "created_at_ms": 1789693331708,
  "data_classifications": [
    "PUBLIC"
  ],
  "domain_id": "domain1-7bd5d963e7ba5160e30e8e3d9e4fafe920baa96f",
  "domain_name": "conformance.entity",
  "economic_terms_ref": null,
  "endpoint": {
    "transport": "https",
    "uri": "https://example.invalid/entity-conformance"
  },
  "entity_root": "ent2-irkeauzvskjivrmrtfdafilptssgrn5w6cnkjlonucvny6pnpe6q",
  "expires_at_ms": null,
  "manifest_version": 1,
  "node_id": "node1-5667c08407a21e54b7459932d465eb9f727889f8",
  "policy_refs": [],
  "protocol_version": "1",
  "provider_authority_inferred": false,
  "required_credentials": [],
  "schema": "entity-service-manifest-v1",
  "service_id": "svc1-conformance-public-api",
  "service_type": "API",
  "signature": {
    "entity_id": "ent2-irkeauzvskjivrmrtfdafilptssgrn5w6cnkjlonucvny6pnpe6q",
    "key_id": "sig-4c20852bc6135a1d",
    "payload_sha256": "a5ac68076b69a8203df36e06c8d85f612b07aa7f9bee4ebacd3ce7cf6d17708a",
    "signature": "WW6j98lZ6CkmnUQJ82olPdXc6a1GdG3ONXr-qAMU1mO28vy5UcXK9cefZX5qA3wOEKOuK2YI3cCHQcT6KLJ2Bg",
    "signature_schema": "entity-signature-record-v2",
    "signed_at_ms": 1789693331711,
    "suite": "ENTITY-SIG-ED25519-v1"
  },
  "source_data_custody_transferred": false,
  "status": "ACTIVE"
}
